{
  "generatedAt": "2026-10-18T10:30:00.000Z",
  "developerModel": "Claude Opus 4.8",
  "reviewerModel": "Grok 4.7",
  "baseline": {
    "gitHead": "e992c1200e84821056c713cf2b57176f05206f1f",
    "packageManager": "pnpm@9.1.4",
    "stack": "Fastify 4.25.2 + Awilix + Drizzle/SQLite + Vitest 1.6 + xo",
    "frontend": false,
    "scripts": ["dev", "test", "test:unit", "test:integration", "drizzle:push", "lint"],
    "testResult": "PASS (1 unit + 1 integration skeleton)",
    "lintResult": "FAIL (2 xo errors in integration spec)",
    "typecheck": "No typecheck script; tsc polluted by vitest html/; src hit: unused ids",
    "audit": "119 vulnerabilities (8 critical, 56 high, 44 moderate, 11 low)",
    "ci": "none",
    "protectedFiles": [
      "src/services/notifications.port.ts",
      "src/services/impl/notification.service.ts"
    ]
  },
  "issues": [
    {
      "id": "ISSUE-001",
      "severity": "P0",
      "category": "bug",
      "title": "Missing order crashes processOrder with a 500",
      "status": "open",
      "location": "src/controllers/my-controller.ts:24-38",
      "evidence": "findFirst is force-unwrapped with `!`. A missing id yields undefined; destructuring throws TypeError → HTTP 500. z.coerce.number() also accepts negatives/non-integers.",
      "remediation": "Return 404 when the order is absent. Constrain orderId to a positive integer in the Zod params schema.",
      "prevention": "Integration test: unknown orderId returns 404 and leaves every product row unchanged; non-integer param → 400.",
      "solidAngle": "",
      "security": false
    },
    {
      "id": "ISSUE-002",
      "severity": "P0",
      "category": "bug",
      "title": "Multi-product stock updates are non-atomic and lose increments under concurrency",
      "status": "open",
      "location": "src/controllers/my-controller.ts:40-81; src/services/impl/product.service.ts:16-46",
      "evidence": "Read-modify-write of absolute available with no transaction around the product loop. Concurrent processOrder can oversell; a mid-loop throw leaves earlier lines committed.",
      "remediation": "One DB transaction per processOrder. Prefer conditional decrement (affected-row count). Roll back the whole order on any line failure.",
      "prevention": "Integration: forced failure on second product restores first product stock; concurrent available=1 ends at 0 with one success.",
      "solidAngle": "SRP",
      "security": false
    },
    {
      "id": "ISSUE-003",
      "severity": "P1",
      "category": "bug",
      "title": "Expirable out-of-stock products are treated as expired",
      "status": "open",
      "location": "src/controllers/my-controller.ts:69-76; src/services/impl/product.service.ts:37-46",
      "evidence": "Controller calls handleExpiredProduct whenever sellable check fails. Service else-branch always sends expiration notification and zeros stock — including available=0 with future expiryDate. Cahier: expiration notification after expiry; OOS while unexpired should follow delay rule.",
      "remediation": "Branch on expiry first in one place: expired → expiration notify + unavailable; unexpired in stock → decrement; unexpired OOS → notifyDelay. Remove duplicated predicate.",
      "prevention": "Unit cases: future expiry + stock → decrement; future expiry + OOS → delay only; past expiry → expiration + available 0.",
      "solidAngle": "SRP",
      "security": false
    },
    {
      "id": "ISSUE-004",
      "severity": "P1",
      "category": "bug",
      "title": "Seasonal rules disagree with the cahier and can wipe on-hand stock",
      "status": "open",
      "location": "src/controllers/my-controller.ts:57-64; src/services/impl/product.service.ts:22-34",
      "evidence": "Before season / after season, handleSeasonalProduct can take leadTime-vs-seasonEnd first and set available=0, discarding stock. Cahier: before season → unavailable notify; delay-vs-season-end when OOS during season.",
      "remediation": "Centralize seasonal policy in ProductService: sell in season with stock; before start → out-of-stock notify, leave available; in-season OOS → delay or out-of-stock by leadTime vs season end; after end → unavailable without wiping on-hand unless explicitly approved.",
      "prevention": "Unit matrix covering in/out season, OOS short/long lead, before start, after end with remaining stock.",
      "solidAngle": "SRP",
      "security": false
    },
    {
      "id": "ISSUE-005",
      "severity": "P1",
      "category": "bug",
      "title": "Normal out-of-stock with leadTime <= 0 notifies nobody",
      "status": "open",
      "location": "src/controllers/my-controller.ts:43-52",
      "evidence": "Delay notification only if leadTime > 0. leadTime 0 skips client announcement while still returning 200.",
      "remediation": "Always call notifyDelay on NORMAL OOS; treat negative leadTime as a domain error.",
      "prevention": "Unit: available=0, leadTime=0 → sendDelayNotification(0, name).",
      "solidAngle": "",
      "security": false
    },
    {
      "id": "ISSUE-006",
      "severity": "P1",
      "category": "bug",
      "title": "Unknown product type is skipped and the order still returns 200",
      "status": "open",
      "location": "src/controllers/my-controller.ts:42-80; src/db/schema.ts:11",
      "evidence": "type is unconstrained text; switch has no default and exhaustiveness is disabled. Unknown type is a silent no-op with 200.",
      "remediation": "Closed union NORMAL|SEASONAL|EXPIRABLE; fail and roll back order on unknown type; remove exhaustiveness disable.",
      "prevention": "Integration: type UNKNOWN → error status, no available changes.",
      "solidAngle": "OCP",
      "security": false
    },
    {
      "id": "ISSUE-007",
      "severity": "P1",
      "category": "bug",
      "title": "Processing the same order twice decrements stock again",
      "status": "open",
      "location": "src/db/schema.ts:21-23; src/controllers/my-controller.ts:15-84",
      "evidence": "orders has only id; no processed flag. Retry of same orderId sells again.",
      "remediation": "Persist processed state on the order inside the same transaction; second call returns existing result without decrement/notify.",
      "prevention": "Integration: two processOrder calls → available moved by one unit total; notifications once.",
      "solidAngle": "SRP",
      "security": false
    },
    {
      "id": "ISSUE-008",
      "severity": "P1",
      "category": "bug",
      "title": "Stock and notification paths write the full product row, including id",
      "status": "open",
      "location": "src/controllers/my-controller.ts:46,61,73; src/services/impl/product.service.ts:16-45",
      "evidence": "Every update is `.set(p)` rewriting the whole selected row (including id), amplifying stale read-modify-write races.",
      "remediation": "Update only changed columns (available, and leadTime when needed); keep primary key in WHERE only.",
      "prevention": "Unit: delay notification leaves name/type/dates unchanged; assert update payload columns.",
      "solidAngle": "SRP",
      "security": false
    },
    {
      "id": "ISSUE-009",
      "severity": "P1",
      "category": "bug",
      "title": "Season and expiry dates are force-unwrapped and null is treated as the epoch",
      "status": "open",
      "location": "src/controllers/my-controller.ts:59,71; src/services/impl/product.service.ts:25-43; src/db/schema.ts:13-15",
      "evidence": "Nullable dates with `!` assertions; null coerces to epoch in comparisons → seasonal/expirable misclassified as OOS/expired and may zero stock.",
      "remediation": "Require season dates for SEASONAL and expiryDate for EXPIRABLE; fail order with domain error if missing.",
      "prevention": "Unit tests with null dates expect error and unchanged available.",
      "solidAngle": "",
      "security": false
    },
    {
      "id": "ISSUE-010",
      "severity": "P1",
      "category": "test",
      "title": "Unit test WHERE clause always matches the first product row",
      "status": "open",
      "location": "src/services/impl/product.service.spec.ts:54-56",
      "evidence": "`eq(product.id, product.id)` shadows the fixture; predicate always true. Green with a single row but does not prove correct id persistence.",
      "remediation": "Filter by inserted id via schema column; assert that row's fields.",
      "prevention": "Insert a second product so a tautology fails.",
      "solidAngle": "",
      "security": false
    },
    {
      "id": "ISSUE-011",
      "severity": "P1",
      "category": "test",
      "title": "Integration test never checks stock or notifications",
      "status": "open",
      "location": "src/controllers/my-controller.integration.spec.ts:39-77",
      "evidence": "Six-product cahier fixture exists but test only asserts HTTP 200 and order id presence. Passes even if stock logic is removed.",
      "remediation": "Assert each product's available and exact notification calls after processOrder.",
      "prevention": "Map each fixture row to an expected outcome; fail if fixture grows without expectations.",
      "solidAngle": "",
      "security": false
    },
    {
      "id": "ISSUE-012",
      "severity": "P1",
      "category": "security",
      "title": "Unauthenticated processOrder is bound on all interfaces",
      "status": "open",
      "location": "src/main.ts:15; src/controllers/my-controller.ts:15-21",
      "evidence": "No auth/authorization on stock-changing POST; listen host 0.0.0.0. Anyone who can reach the port can mutate inventory.",
      "remediation": "Gate 1 decision: defer auth for local kata OR require credential before stock writes; bind loopback in non-prod if deferred.",
      "prevention": "Config/test that listen host is loopback unless explicit env opts into exposure; auth rejection test once in scope.",
      "solidAngle": "",
      "security": true
    },
    {